,Links
Dual Architecture for Name Entity Extraction and Relation Extraction with Applications in Medical Corpora,https://openreview.net/forum?id=S1EBBh_0_qe
Unified NMT models for the Indian subcontinent transcending script-barriers,https://openreview.net/forum?id=Suu6OdT8Ml
Reframing Instructional Prompts to GPTk\'s Language,https://openreview.net/forum?id=rx5o3aIpqKO
"When Chosen Wisely, More Data Is What You Need: A Universal Sample-Efficient Strategy For Data Augmentation",https://openreview.net/forum?id=3Rfj-IdJ-s
EigenNoise: A Contrastive Prior to Warm-Start Representations,https://openreview.net/forum?id=Ij_XbC_RuLtK
Finding the Dominant Winning Ticket in Pre-Trained Language Models,https://openreview.net/forum?id=gLfSnQcTFgM
TENT: Text Classification Based on ENcoding Tree Learning,https://openreview.net/forum?id=y4pgVX_ypf9
Can Rationalization Improve Robustness?,https://openreview.net/forum?id=uWvW_Z4P8f
From Stance to Concern: Adaptation of Propositional Analysis to New Tasks and Domains,https://openreview.net/forum?id=7M6Rudku_sk
E-KAR: A Benchmark for Rationalizing Natural Language Analogical Reasoning,https://openreview.net/forum?id=9kXOFRtrEj
Training Dynamics for Text Summarization Models,https://openreview.net/forum?id=UFg2s8Yabc7
A Simple Information-Based Approach to Unsupervised Domain-Adaptive Aspect-Based Sentiment Analysis,https://openreview.net/forum?id=ULHJwUO0AUx
Your fairness may vary: Pretrained language model fairness in toxic text classification,https://openreview.net/forum?id=_twxtCxGs9l
Multi-layer Biaffine Model for Neural Dependency Parsing,https://openreview.net/forum?id=XhSkr46udBW
Predictive text for agglutinative and polysynthetic languages,https://openreview.net/forum?id=pJeVcX8_Et
Cross-domain Named Entity Recognition via Graph Matching,https://openreview.net/forum?id=pfjbxxqih3x
Should a Bot be Sarcastic?\\\\\\\\Understanding User Preferences Towards Sarcasm Generation,https://openreview.net/forum?id=b5YiEef9sTI
Inverse is Better! Fast and Accurate Prompt for Slot Tagging,https://openreview.net/forum?id=XKEFSwYUewV
A self-reliant finite automata for reduplication detection,https://openreview.net/forum?id=2yB6VQkPJW6
The Dark Side of the Language: Pre-trained Transformers in the DarkNet,https://openreview.net/forum?id=ZySnFGEBgvC
MOROCCO: Model Resource Comparison Framework,https://openreview.net/forum?id=fa2XGLrSkI
Active Dialogue Simulation in Conversational Systems,https://openreview.net/forum?id=5GdS7K37pKN
Lot or Not: Identifying Multi-Quantity Offerings in E-Commerce ,https://openreview.net/forum?id=xQOZlfF8M-
A Survey of Networking Cipher Algorithms and How Natural Language Can Be Used to Enhance Them,https://openreview.net/forum?id=vmqMLOTPfcG
Aggregating Pairwise Semantic Differences for Few-Shot Claim Veracity Classification,https://openreview.net/forum?id=WEyYNUwgD9u
Learning to Transfer Prompts for Text Generation,https://openreview.net/forum?id=M9sPdWzEu0
One Agent To Rule Them All: Towards Multi-agent Conversational AI,https://openreview.net/forum?id=hqmnjdcYZW7
All Birds with One Stone: Multi-task Learning for Inference with One Forward Pass,https://openreview.net/forum?id=BXfSKkEbCtW
Enhancing Robustness of Pre-trained Language Model with Lexical Simplification,https://openreview.net/forum?id=3FIjaX458P
AdapterBias: Parameter-efficient Token-dependent Embedding Shift for Adapters in NLP Tasks,https://openreview.net/forum?id=VZ2oO6KYbBB
Solving Probability and Statistics Problems by Program Synthesis,https://openreview.net/forum?id=XOI2xQDpzqz
ROCK: A Causal Inference Framework for Reasoning about Commonsense Causality,https://openreview.net/forum?id=sEd4EJK-QVl
Sparsifying Transformer Models with Trainable Representation Pooling,https://openreview.net/forum?id=c3wXWy6xe3O
Better Language Model with Hypernym Class Prediction,https://openreview.net/forum?id=YjZH6EpuSY
Structural Characterization for Dialogue Disentanglement,https://openreview.net/forum?id=OC1o4_OI6Jw
Event Detection via Derangement Question Answering,https://openreview.net/forum?id=VRhs8XzoF6W
Knowledge Enhanced Embedding: Improve Model Generalization Through Knowledge Graphs,https://openreview.net/forum?id=d8efWWr2IPH
D$^4$: A Psychiatrist-proofread Dialogue Dataset for Depression Diagnosis,https://openreview.net/forum?id=QGZMStjUHVt
Are Shortest Rationales the Best Explanations For Human Understanding?,https://openreview.net/forum?id=W2wE4vUe1Te
DISAPERE: A Dataset for Discourse Structure in Peer Review Discussions,https://openreview.net/forum?id=8llHNkzlQMe
Low rank softmax can have unargmaxable classes in theory but rarely in practice,https://openreview.net/forum?id=9lH-J1uPY2i
Controlling Pretrained Language Generation Models by Learning to Focus,https://openreview.net/forum?id=IEcWf--zVAG
Quality-Aware Decoding for Neural Machine Translation,https://openreview.net/forum?id=aYNjzZJP9qa
Modeling speech recognition and synthesis simultaneously: Encoding and decoding lexical and sublexical semantic information into speech with no access to speech data,https://openreview.net/forum?id=Vtl4GfQJ9K
CTM - A Model for Large-Scale Multi-View Tweet Topic Classification,https://openreview.net/forum?id=CxLph8ur-hB
Feature-rich Open-vocabulary Interpretable Neural Representations for All of the World\\u2019s 7000 Languages,https://openreview.net/forum?id=IFISLX7krsj
"Vision-and-Language Navigation: A Survey of Tasks, Methods, and Future Directions",https://openreview.net/forum?id=jAk0IoZVbP6
Bridging the Data Gap between Training and Inference for Unsupervised Neural Machine Translation,https://openreview.net/forum?id=WtlQ4cal2Y-
MINER: Improving Out-of-Vocabulary Named Entity Recognition from an Information Theoretic Perspective,https://openreview.net/forum?id=3-g3nuYuf_w
Metaphor Detection for Low Resource Languages: From Zero-Shot to Few-Shot Learning in Middle High German,https://openreview.net/forum?id=ZOTtvHg_uR2
Contextual Fine-to-Coarse Distillation for Coarse-grained Response Selection in Open-Domain Conversations,https://openreview.net/forum?id=sRQa1-O3N0
Softmax Bottleneck Makes Language Models Unable to Represent Multi-mode Word Distributions,https://openreview.net/forum?id=sagXUkJ1fDn
Freezing the Pivot for Triangular Machine Translation,https://openreview.net/forum?id=h3nJi5MOm04
Topic Sentence Named Entity Recognition: A New Task with Its Dataset and Benchmarks,https://openreview.net/forum?id=uwGI98wh025
Contrastive Learning for Low Resource Machine Translation,https://openreview.net/forum?id=u_9SBxaOqI-
Few-shot Controllable Style Transfer for Low-Resource Multilinugal Settings,https://openreview.net/forum?id=iU7nNeWLbA7
Cross-lingual Word Embeddings in Hyperbolic Space,https://openreview.net/forum?id=kNT-aYVaYyx
PESTO: A Post-User Fusion Network for Rumour Detection on Social Media,https://openreview.net/forum?id=vVNYde75l4m
Context-Paraphrase Enhanced Commonsense Question Answering,https://openreview.net/forum?id=-eOO1r7NB7N
Generative Pretraining for Paraphrase Evaluation,https://openreview.net/forum?id=-dylrl0Ell
EmoWOZ: A Large-Scale Corpus and Labelling Scheme for Emotion Recognition in Task-Oriented Dialogue Systems,https://openreview.net/forum?id=cpNsYH0OwF
Deep-to-bottom Weights Decay: A Systemic Knowledge Review Learning Technique for Transformer Layers in Knowledge Distillation,https://openreview.net/forum?id=I-9kHa74lzM
IDPG: An Instance-Dependent Prompt Generation Method,https://openreview.net/forum?id=U0seCGsNj78
Are We Evaluating Paraphrase Generation Accurately?,https://openreview.net/forum?id=YBujxHx3VmL
LordBERT: Embedding Long Text by Segment Ordering with BERT,https://openreview.net/forum?id=b-064TCPoyB
MDERank: A Masked Document Embedding Rank Approach for Unsupervised Keyphrase Extraction,https://openreview.net/forum?id=GzK8XG-3MvE
Pre-training Pre-trained Models with Auxiliary Labels and Fine-tuning for Text Classification,https://openreview.net/forum?id=A-9_nSN2UIu
EntSUM: A Data Set for Entity-Centric Extractive Summarization,https://openreview.net/forum?id=1llL_tYlV54
Mukayese: Turkish NLP Strikes Back,https://openreview.net/forum?id=ThTMwcCPzkG
Alignment based Sequence Ensemble with Multiple Results from a Single Neural Model Architecture,https://openreview.net/forum?id=6awg2A5yUm_
Removing Out-of-Distribution Data Improves Adversarial Robustness,https://openreview.net/forum?id=KixJ4-yJsZI
KART: Parameterization of Privacy Leakage Scenarios from Pre-trained Language Models,https://openreview.net/forum?id=_GmDuK79Jtl
Discourse Context Primes Hindi Word Order,https://openreview.net/forum?id=dLmmkAkIWSF
Dict-NMT: Bilingual Dictionary based NMT for Extremely Low Resource Languages,https://openreview.net/forum?id=04Z6uZG1CII
SHCT: A Successively Hierarchical Conditional Transformer for  Controllable Paraphrase Generation,https://openreview.net/forum?id=ZCmUqcIjuGc
Knowledgeable Prompt-tuning: Incorporating Knowledge into Prompt Verbalizer for Text Classification,https://openreview.net/forum?id=bmCKitFWGD0
Extracting and Inferring Personal Attributes from Dialogue,https://openreview.net/forum?id=RTLpzL_eSLy
FedParsing: a Semi-Supervised Federated Learning Model on Semantic Parsing,https://openreview.net/forum?id=Oeikp9N4fzi
Fair NLP Models with Differentially Private Text Encoders,https://openreview.net/forum?id=TA1_okqeCFa
Probing Schema Linking Information from Pre-trained Language Models for Text-to-SQL Parsing,https://openreview.net/forum?id=uKGVHs4EMy
Letters from the past: modeling historical sound change through diachronic character embeddings,https://openreview.net/forum?id=BNLGjR2DGeu
Improving Word Translation via Two-Stage Contrastive Learning,https://openreview.net/forum?id=ycgOlOnbbMq
Persian Natural Language Inference: A Meta-learning approach,https://openreview.net/forum?id=y10NjrWsSmH
On Vision Features in Multimodal Machine Translation,https://openreview.net/forum?id=z8HsAJoLGF6
Learning and Evaluating Character Representations in Novels,https://openreview.net/forum?id=zHdGnwxZCdo
Self-training with Modeling Ambiguous Data for Low-Resource Relation Extraction,https://openreview.net/forum?id=h4CH-gL3b_x
Interpretable embeddings to understand computing careers,https://openreview.net/forum?id=22Vop3KyNI1
Can Explanations Be Useful for Calibrating Black Box Models?,https://openreview.net/forum?id=IZreMhYT8gW
Text Smoothing: Enhance Various Data Augmentation Methods on Text Classification Tasks,https://openreview.net/forum?id=0X1-qVxSlzm
An Empirical Study on Explanations in Out-of-Domain Settings,https://openreview.net/forum?id=Tle_t5AxcTL
KenMeSH: Knowledge-enhanced End-to-end Biomedical Text Labelling,https://openreview.net/forum?id=K7KZoGl7M2r
Morphosyntactic Tagging with Pre-trained Language Models for Arabic and its Dialects,https://openreview.net/forum?id=qkgEZxDAGh
Improving Neural Topic Models by Contrastive Learning with BERT,https://openreview.net/forum?id=SywWbpTa8ix
Generation of News Articles from Tweets : An Experiment,https://openreview.net/forum?id=ULxpGsMp5HY
Adaptive Testing and Debugging of NLP Models,https://openreview.net/forum?id=LcWuB5SjD9
Reasoning Like Program Executors,https://openreview.net/forum?id=CBaAwVcAd2G
"One Country, 700+ Languages: NLP Challenges for Underrepresented Languages and Dialects in Indonesia",https://openreview.net/forum?id=zZOyzUCFFt
Multilingual offensive lexicon annotated with contextual information,https://openreview.net/forum?id=WCBAn7V584l
Bootstrapping Text Anonymization Models with Distant Supervision,https://openreview.net/forum?id=-MoY6seu_x
QubitE: Qubit Embedding for Knowledge Graph Completion,https://openreview.net/forum?id=6mpzVBZ6Mf8
"AMRize, then Parse! Enhancing AMR Parsing with PseudoAMR Data",https://openreview.net/forum?id=5Q-ihWzhSi
Zero-Shot Aspect-Based Scientific Document Summarization using Self-Supervised Pre-training,https://openreview.net/forum?id=iEqUccu6yII
Using Interactive Feedback to Improve the Accuracy and Explainability of Question Answering Systems Post-Deployment,https://openreview.net/forum?id=Gs-GKGuR0t
Analyzing Dynamic Adversarial Training Data in the Limit,https://openreview.net/forum?id=f9gYRaGv934
Evidence Decomposition Graph Network for Fact Verification,https://openreview.net/forum?id=3Huneg3YkiV
Control False Negative Instances In Contrastive Learning To ImproveLong-tailed Item Categorization,https://openreview.net/forum?id=L7d3vpKjQhZ
"FrugalScore: Learning Cheaper, Lighter and Faster Evaluation Metrics for Automatic Text Generation",https://openreview.net/forum?id=JT-Xedd1zJQ
Cross-Lingual UMLS Named Entity Linking using UMLS Dictionary Fine-Tuning,https://openreview.net/forum?id=vyiDjt4UNPv
Incorporating Dual-Aware with Hierarchical Interactive Memory Networks for Task-Oriented Dialogue,https://openreview.net/forum?id=YRia3RRZHXm
Expanding Pretrained Models to Thousands More Languages via Lexicon-based Adaptation,https://openreview.net/forum?id=5Ph0fRJg9c-
Understanding and Improving Sequence-to-Sequence Pretraining for Neural Machine Translation,https://openreview.net/forum?id=ZkFuUac0Hc0
Description-Driven Task-Oriented Dialog Modeling,https://openreview.net/forum?id=NaVgf-NPQev
MSP: Multi-Stage Prompting for Making Pre-trained Language Models Better Translators,https://openreview.net/forum?id=Uhnw1smvKt
Code Synonyms Do Matter: Multiple Synonyms Matching Network for Automatic ICD Coding,https://openreview.net/forum?id=kXo7lEh7OaX
Towards Focused and Connected Document-Level Event Extraction,https://openreview.net/forum?id=og2PWB6U0K0
GLM: General Language Model Pretraining with Autoregressive Blank Infilling,https://openreview.net/forum?id=QXMahjntD_C
PeerSum: A Peer Review Dataset for Abstractive Multi-document Summarization,https://openreview.net/forum?id=-NcPJhsLhtJ
A Simple General Method for Detecting Textual Adversarial Examples,https://openreview.net/forum?id=7vSof0oWJKN
Multi-Task Pre-Training for Plug-and-Play Task-Oriented Dialogue System,https://openreview.net/forum?id=46-q5-S-mEF
A Simple Overlapping Relation Extraction Method Based on Dropout,https://openreview.net/forum?id=HlTDIkxaWCI
Target-Guided Dialogue Response Generation Using Commonsense and Data Augmentation,https://openreview.net/forum?id=nRqzJxJXcCb
Neural Pipeline for Zero-Shot Data-to-Text Generation,https://openreview.net/forum?id=Lz2fD-uQyeh
Parameter-Efficient Abstractive Question Answering over Tables and over Text,https://openreview.net/forum?id=Qj5PZOZgPRS
Error-Correcting Codes For Approximate Neural Sequence Prediction,https://openreview.net/forum?id=6NEOigYYbRk
Prompt-Learning for Fine-Grained Entity Typing,https://openreview.net/forum?id=7EemgCzGXAN
Probing Position-Aware Attention Mechanism in Long Document Understanding,https://openreview.net/forum?id=QAuS7grHtkO
Distantly Supervised Named Entity Recognition with Category-Oriented Confidence Calibration,https://openreview.net/forum?id=H6kbvowD2Bv
CLGP: Multi-Feature Embedding based Cross-Attention for Chinese NER,https://openreview.net/forum?id=BM3y-ZnNwoG
Detecting Rumor Veracity with Only Textual Information by Double-Channel Structure,https://openreview.net/forum?id=paaFqtxNcxT
Knowledge Graph is in Rescue: Task Oriented Dialogue System for Response Generation without NLU and DM,https://openreview.net/forum?id=UQk8XMFAE2u
Enabling Multimodal Generation on CLIP via Vision-Language Knowledge Distillation,https://openreview.net/forum?id=YTGg7kv8qIq
HIE-SQL: History Information Enhanced Network for Context-Dependent Text-to-SQL Semantic Parsing,https://openreview.net/forum?id=fX8TXF-LD21
TableIE: Capture the Interactions among Joint Information Extraction Explicitly via Double Tables,https://openreview.net/forum?id=3_KnXEevm2E
Towards Unified Prompt Tuning for Few-shot Learning,https://openreview.net/forum?id=9O7V12vSx8t
Metadata Shaping: Natural Language Annotations for the Long Tail,https://openreview.net/forum?id=7A4Fel5OBYQ
Word2Box: Capturing Set-Theoretic Semantics of Words using BoxEmbeddings,https://openreview.net/forum?id=NThz_6MqDuG
KESA: A Knowledge Enhanced Approach For Sentiment Analysis,https://openreview.net/forum?id=1z0HSEAOoWs
Multi-stage Distillation Framework for Cross-Lingual Semantic Similarity Matching,https://openreview.net/forum?id=GCq16dADbK7
Get Your Model Puzzled: Introducing Crossword-Solving as a New NLP Benchmark,https://openreview.net/forum?id=v4hr8SvBl4L
TACO: Pre-training of Deep Transformers with Attention Convolution using Disentangled Positional Representation,https://openreview.net/forum?id=-AGBhcs5JP9
Aligning Annotation with User Perceptions for the Evaluation of Voice-Based Intelligent Personal Digital Assistants ,https://openreview.net/forum?id=6-l23Qjgu2u
Redistributing Low-Frequency Words: Making the Most of Monolingual Data in Non-Autoregressive Translation,https://openreview.net/forum?id=Zh4kJ4JOcHo
Self-Supervised Contrastive Learning with Adversarial Perturbations for Robust Pretrained Language Models,https://openreview.net/forum?id=1Sx_XJeJTLh
Voxel-informed Language Grounding,https://openreview.net/forum?id=mpmtcQTIErU
Textual Entailment with Dynamic Contrastive Learning for Zero-shot NER,https://openreview.net/forum?id=-J2Pefs3cw
Multi-head or Single-head? An Empirical Comparison for Transformer Training,https://openreview.net/forum?id=UiSsgooXn_4
Two-Level Supervised Contrastive Learning for Response Selection in Multi-Turn Dialogue,https://openreview.net/forum?id=N0b2XDcHLLI
Diversifying Neural Text Generation with Part-of-Speech Guided Softmax and Sampling,https://openreview.net/forum?id=xU6V4SrKd8C
Zero-Shot Dependency Parsing with Worst-Case Aware Automated Curriculum Learning,https://openreview.net/forum?id=h0lckggpp4X
Cross-Document Temporal Relation Extraction with Temporal Anchoring Events,https://openreview.net/forum?id=h9FRrlcs8yo
Bi-Matching Mechanism to Combat the Long Tail of Word Sense Disambiguation,https://openreview.net/forum?id=FvmGqUEuh7
Neural Dynamic Focused Topic Model,https://openreview.net/forum?id=LNqI1OWu4NI
"Evaluating Inclusivity, Equity, and Accessibility of NLP Technology: A Case Study for Indian Languages",https://openreview.net/forum?id=lcerLgEt6ss
XLM-E: Cross-lingual Language Model Pre-training via ELECTRA,https://openreview.net/forum?id=hYB_ozQvbVV
Event-Event Relation Extraction using Probabilistic Box Embedding,https://openreview.net/forum?id=USuyAFWEuY
Salient Phrase Aware Dense Retrieval: Can a Dense Retriever Imitate a Sparse One?,https://openreview.net/forum?id=bkagwUGBYU1
Towards Improving Topic Models with the BERT-based Neural Topic Encoder,https://openreview.net/forum?id=qrCCfJ6uR1m
Moving the Eiffel Tower to ROME: Tracing and Editing Facts in GPT,https://openreview.net/forum?id=mMECu_poAs
Nested Named Entity Recognition as Latent Lexicalized Constituency Parsing,https://openreview.net/forum?id=2D3ibn1aeUS
$AmbiPun$ : Generating Humorous Puns with Ambiguous Context,https://openreview.net/forum?id=RhhZo7CpksR
Unsupervised multiple-choice question generation for out-of-domain Q\\\\&A fine-tuning,https://openreview.net/forum?id=JWVB2_QbT8W
"Relevance in Dialogue: Is Less More? An Empirical Comparison of Existing Metrics, and a Novel Simple Metric",https://openreview.net/forum?id=SFVLa0a4rNg
Graph-based Fine-grained Multimodal Attention Mechanism for Sentiment Analysis,https://openreview.net/forum?id=de9ufgUZFox
Morphology Informed Selections for Subword Vocabulary Size,https://openreview.net/forum?id=nuocH643Ezt
MoFE: Mixture of Factual Experts for Controlling Hallucinations in Abstractive Summarization,https://openreview.net/forum?id=JegLdW0zORF
Achieving Conversational Goals with Unsupervised Post-hoc Knowledge Injection,https://openreview.net/forum?id=NEvmCSnnj63
"Accurate, yet Inconsistent? Consistency Analysis on Language Models",https://openreview.net/forum?id=PZIiXj2FcAP
Quantum-inspired Representation for Long-tail Senses of Word Sense Disambiguation,https://openreview.net/forum?id=r6z-A8wyD-W
Towards Coding Social Science Datasets with Language Models,https://openreview.net/forum?id=Sx5wGWcuETA
Utterance Rewriting with Contrastive Learning in Multi-turn Dialogue,https://openreview.net/forum?id=HQ1M0wv2RrL
AutoTriggER: Named Entity Recognition with Auxiliary Trigger Extraction,https://openreview.net/forum?id=8LQwB0FkR0X
Non-Parametric Domain Adaptation for End-to-End Speech Translation,https://openreview.net/forum?id=1GZzXcmivZ4
Revisiting Softmax for Uncertainty Approximation in Text Classification,https://openreview.net/forum?id=cnMI-mshhv5
Listen to Both Sides and be Enlightened! -- Hierarchical Modality Fusion Network for  Entity and Relation Extraction,https://openreview.net/forum?id=DX8E-03pBrV
MarkBERT: Marking Word Boundaries Improves Chinese BERT,https://openreview.net/forum?id=7uE-SSLTgxw
ReCo: Reliable Multi-hop Causal Reasoning via Structural Causal Recurrent Unit,https://openreview.net/forum?id=8kD13-NXpZ
Comparative Opinion Summarization via Collaborative Decoding,https://openreview.net/forum?id=SpwEk_yswpS
Constructing Phrase-level Semantic Labels to Form Multi-GrainedSupervision for Image-Text Retrieval,https://openreview.net/forum?id=IbQJVkI-96I
BERT is Robust! A Case Against Synonym-Based Adversarial Examples in Text Classification,https://openreview.net/forum?id=gu5N_MqOzHp
A Comparative Study of Faithfulness Metrics for Model Interpretability Methods,https://openreview.net/forum?id=8BUje8JD-_Q
ArchivalQA: A Large-scale Benchmark Dataset for Open Domain Question Answering over Archival News Collections,https://openreview.net/forum?id=4zUWJyt0Ja4
Textual Backdoor Attacks Can Be More Harmful via Two Simple Tricks,https://openreview.net/forum?id=HZRUtYo7x9R
Divide and Rule: Effective Pre-Training for Context-Aware Multi-Encoder Translation Models,https://openreview.net/forum?id=H8L5q6lcWqM
Generic Dependency Modeling in Multi-Party Conversation,https://openreview.net/forum?id=IQWOVFz1Bs
Contrastive Demonstration Tuning for Pre-trained Language Models,https://openreview.net/forum?id=RFVK6x4NBhD
On Spoken Language Understanding Systems for Low Resourced Languages,https://openreview.net/forum?id=SrW4CWx3ox5
Can Pre-trained Language Models Interpret Similes as Smart as Human?,https://openreview.net/forum?id=ecHLq1bWFvk
The patient is more dead than alive: exploring the current state of the multi-document summarisation of the biomedical literature,https://openreview.net/forum?id=YDwkCkgFFFn
ICLEA: Interactive Contrastive Learning for Self-supervised Entity Alignment,https://openreview.net/forum?id=6DOaEO5KV0
Learning Universal Sentence Embeddings with Large-scale Parallel Translation Datasets,https://openreview.net/forum?id=MHnRhU7zmDX
MoEfication: Conditional Computation of Transformer Models for Efficient Inference,https://openreview.net/forum?id=WuxlPPY23K
RELiC: Retrieving Evidence for Literary Claims,https://openreview.net/forum?id=xcelRQScTjP
A Dual-Channel Framework for Sarcasm Recognition by Detecting Sentiment Conflict,https://openreview.net/forum?id=5P8vhb5bV2_
A Parameter Aggregation Strategy on Personalized Federated Learning,https://openreview.net/forum?id=dshFaeku9Me
Graph Neural Networks for Multiparallel Word Alignment,https://openreview.net/forum?id=k9p9ML7otLG
ComSearch: Equation Searching with  Combinatorial Mathematics for Solving Math Word Problems with Weak Supervision,https://openreview.net/forum?id=GAtDhA2VH88
MATHion: Solving Math Word Problems with Logically Consistent Problems,https://openreview.net/forum?id=bAyJN10c_5N
Under the Morphosyntactic Lens: A Multifaceted Evaluation of Gender Bias in Speech Translation,https://openreview.net/forum?id=zm8gQvBzFAM
One-Shot Learning from a Demonstration with Hierarchical Latent Language,https://openreview.net/forum?id=uecnUP0-PjZ
UCTopic: Unsupervised Contrastive Learning for Phrase Representations and Topic Mining,https://openreview.net/forum?id=lm8Fb0c5k7_
AlephBERT: Language Model Pre-training and Evaluation from Sub-Word to Sentence Level,https://openreview.net/forum?id=xicP8EAgXFU
AutoMin: A Novel Dataset for Automatic Minuting from Multi-Party Meetings in English and Czech,https://openreview.net/forum?id=o0CMTqnn9kM
Multi-Granularity Contrastive Knowledge Distillation for Multimodal Named Entity Recognition,https://openreview.net/forum?id=Xf7cE59PJuP
The Change that Matters in Discourse Parsing: Estimating the Impact of Domain Shift on Parser Error,https://openreview.net/forum?id=KkF3IHfdT_z
An Empirical Study of Document-to-document Neural Machine Translation,https://openreview.net/forum?id=sU9fYzNZ3xX
A Re-examination of Neural Selective Prediction for Natural Language Processing,https://openreview.net/forum?id=sVMB_r7oPpv
The Algorithmic Inflection and Morphological Variability of Russian,https://openreview.net/forum?id=TpPhoHHfIKl
Multi-Stage Prompting for Knowledgeable Dialogue Generation,https://openreview.net/forum?id=vS9XeUdk-Yc
Learning from Missing Relations: Contrastive Learning with Commonsense Knowledge Graphs for Commonsense Inference,https://openreview.net/forum?id=E7xLOw5YHR5
ANNA: Enhanced Language Representation for Question Answering,https://openreview.net/forum?id=xTsom6Vyem0
Meet Your Favorite Character: Open-domain Chatbot Mimicking Fictional Characters with only a Few Utterances,https://openreview.net/forum?id=eYe4HOt0Zx
CLD\\u00b2: Language Documentation Meets Natural Language Processing for Revitalising Endangered Languages,https://openreview.net/forum?id=LykFSG2ZUZS
BACN: Bi-direction Attention Capsule-based Network for Multimodal Sentiment Analysis,https://openreview.net/forum?id=fCqi1FgubBb
Rebuild and Ensemble: Exploring Defense Against Text Adversaries,https://openreview.net/forum?id=zybG6tEamxk
From Rewriting to Remembering: Common Ground for Conversational QA Models,https://openreview.net/forum?id=Dkayo1AmMpC
Knowledge-guided Transformer for Joint Theme and Emotion Classification of Chinese Classical Poetry,https://openreview.net/forum?id=kcZcqo9ROA-
