,Links
Few-Shot Named Entity Recognition with Biaffine Span Representation,https://openreview.net/forum?id=5aeBigqvO-P
SegMix: A Simple Structure-Aware Data Augmentation Method,https://openreview.net/forum?id=EI9qCtD7u54
Tell me who you are and i\'ll tell you what to do: A Persona Grounded Task Oriented Dialogue Generation System,https://openreview.net/forum?id=cbJwLMMduMs
Counting What Deserves to be Counted for Graph Parsing,https://openreview.net/forum?id=X0EjCsA_c8l
Real-Time Visual Feedback to Guide Benchmark Creation: A Human-and-Metric-in-the-Loop Workflow,https://openreview.net/forum?id=ydSsRlGlDfD
Revisiting Transformer-based Models for Long Document Classification,https://openreview.net/forum?id=qPUpmrqK2K8
Exploring Human-judged and Automatically-induced Correction Difficulty for Grammatical Error Correction,https://openreview.net/forum?id=jO0vmMUrlMB
Speech Synthesis for Low Resource Languages using Transliteration  Enabled Transfer Learning,https://openreview.net/forum?id=-GpDH3hu9m6
HonestBait: Headline Generation via Faithful Forward Reference,https://openreview.net/forum?id=xfBbBwOkwgQ
Contextualized Semantic Distance via Pre-trained Language Model,https://openreview.net/forum?id=KkrkpXyyDky
KALA: Knowledge-Augmented Language Model Adaptation,https://openreview.net/forum?id=qTNMTzkWhgT
TREND: Trigger-Enhanced Relation-Extraction Network for Dialogues,https://openreview.net/forum?id=Wl3XjEMGPsy
Multimodal Semi-supervised Learning for Disaster Tweet Classification,https://openreview.net/forum?id=Udw4IUCPew6
Retrieval-based Layer-wise Adaptive Transformer for Source Code Summarization,https://openreview.net/forum?id=zikTfLBMXAg
Sequence-to-sequence AMR Parsing with Ancestor Information,https://openreview.net/forum?id=WkqKzBx2UZO
DoTAT: A Domain-oriented Text Annotation Tool,https://openreview.net/forum?id=fEiC5ODIGk8
Compressing Sentence Representation via Homomorphic Projective Distillation,https://openreview.net/forum?id=n3cvM4Phez9
Plug-Tagger: A Pluggable Sequence Labeling Framework with Pre-trained Language Models,https://openreview.net/forum?id=LVKqHo_PPs
A Probabilistic Framework for Analyzing Moral Perspectives in the COVID-19 Vaccine Debate,https://openreview.net/forum?id=klQP_rP-QoC
Improving Aspect Extraction based on Rules through Deep Syntax-Semantics Communication,https://openreview.net/forum?id=20Lgo1A-aSh
On the interpretability and significance of bias metrics in texts: a PMI-based approach,https://openreview.net/forum?id=f7ia5zVf06N
A Deep Generative XAI Framework for Natural Language Inference Explanations Generation,https://openreview.net/forum?id=kFPmMu_2fVA
Meta-Adapter: Parameter Efficient Few-Shot Learning through Meta-Learning,https://openreview.net/forum?id=bQt8dWKsfso
An Exploration of Prompt-Based Zero-Shot Relation Extraction Method,https://openreview.net/forum?id=2eFOOv7ufn
Efficient Hyper-parameter Search for Knowledge Graph Embedding,https://openreview.net/forum?id=cwPFJBwI0hG
Mitigating Gender Bias in Machine Translation through Adversarial Learning,https://openreview.net/forum?id=nZdr6_UDzW
A Structure-Aware Argument Encoder for Literature Discourse Analysis,https://openreview.net/forum?id=ds---HqfFWz
Placing (Historical) Events on a Timeline: A Classification cum Co-ref Resolution Approach,https://openreview.net/forum?id=zMLzqW4AC20
Modeling Hierarchical Syntax Structure with Triplet Position for Source Code Summarization,https://openreview.net/forum?id=w8g-gf1wjjl
KNN-BERT: Fine-Tuning Pre-Trained Models with KNN Classifier,https://openreview.net/forum?id=BecjRxs-lY5
More Than Just Attention: Improving Cross-Modal Attentions with Contrastive Constraints for Image-Text Matching,https://openreview.net/forum?id=wqzdShr8Tie
Discriminative Models Still Outperform Generative Models in Aspect Based Sentiment Analysis In Cross-Domain and Cross-Lingual Settings,https://openreview.net/forum?id=BB1pmTFXqOS
Negative-aware Entity Set Expansion,https://openreview.net/forum?id=Vw2vryLjiiC
Mix and Match: Learning-free Controllable Text Generationusing Energy Language Models,https://openreview.net/forum?id=CzENLR_1iTF
Improving Abstractive Dialogue Summarization with Speaker-Aware Supervised Contrastive Learning,https://openreview.net/forum?id=LhoivcdFKwD
Lifting the Curse of Multilinguality by Pre-training Modular Transformers,https://openreview.net/forum?id=47v7cxS_5cE
Transductive Learning for Abstractive News Summarization,https://openreview.net/forum?id=2GFWBz-q4-Y
Composable Sparse Fine-Tuning for Cross-Lingual Transfer,https://openreview.net/forum?id=JCipWpsW6R
How Do Seq2Seq Models Perform on End-to-End Data-to-Text Generation?,https://openreview.net/forum?id=kq1EhM0vMM6
The Power of Prompt Tuning for Low-Resource Semantic Parsing,https://openreview.net/forum?id=jxj0WRxKSix
Exploring and Adapting Chinese GPT to  Pinyin Input Method,https://openreview.net/forum?id=M2lVno3swO7
Empirical Evaluation of Topic Zero- and Few-Shot Learning for Stance Dissonance Detection,https://openreview.net/forum?id=C9p4LKExawN
Multilingual pre-training with Language and Task Adaptation for Multilingual Text Style Transfer,https://openreview.net/forum?id=rWPLdCIiY6g
POLITICS: Pretraining with Same-story Article Comparison for Ideology Prediction and Stance Detection,https://openreview.net/forum?id=I9xmnBFJTQy
Image Retrieval from Contextual Descriptions,https://openreview.net/forum?id=ObaBB7DvM4
Tackling Situated Multi-Modal Task-Oriented Dialogs with a Single Transformer Model,https://openreview.net/forum?id=NajekV9uBas
Summ$^N$: A Multi-Stage Summarization Framework for Long Input Dialogues and Documents,https://openreview.net/forum?id=BcTg9ch2BWQ
A Bit Bayesian Facilitates Efficient Training in Token Classification,https://openreview.net/forum?id=M-A1d9yxSe
A Simple Unsupervised Approach for Coreference Resolution using Rule-based Weak Supervision,https://openreview.net/forum?id=D_TuAZQZPEl
Seq2rel: A sequence-to-sequence-based approach for document-level relation extraction,https://openreview.net/forum?id=JUrlIlxIEun
CINO: A Chinese Minority Pre-trained Language Model,https://openreview.net/forum?id=_0jeDIyBNu_
A Model-agnostic Data Manipulation Method for Persona-based Dialogue Generation,https://openreview.net/forum?id=TSMRRUNJnZZ
Combining static and contextualised multilingual embeddings,https://openreview.net/forum?id=LRr5uSphqoQ
WLASL-LEX: a Dataset for Recognising Phonological Properties in American Sign Language,https://openreview.net/forum?id=wXRPHXseNg3
A Graph Enhanced Label Attention Model for ICD Coding from Clinical Text,https://openreview.net/forum?id=qlYYH9VLVbq
Generating Diverse and High-Quality Abstractive Summaries with Variational Transformers,https://openreview.net/forum?id=vUNJM5__Yrw
Unsupervised Open-Domain Question Answering with Higher Answerability,https://openreview.net/forum?id=-cs5MvTAppW
Distill and Calibrate: Denoising Inconsistent Labeling Instances for Chinese Named Entity Recognition,https://openreview.net/forum?id=H_LmmxjQrqw
Translating Embeddings in Document for Modeling Multi-relational Graphs,https://openreview.net/forum?id=BHUCb6_xBde
Uncertainty-Based Joint Training For Semi-Supervised Math Word Problem,https://openreview.net/forum?id=pIV0eeYD6E0
FairLex: A Multilingual Benchmark for Evaluating Fairness in Legal Text Processing,https://openreview.net/forum?id=zn-TaFtaFaK
Alleviating the Sparsity of Open Knowledge Graphs with Pretrained Contrastive Learning,https://openreview.net/forum?id=0TReq1EztTt
Efficient Speech Translation with Pre-trained models,https://openreview.net/forum?id=nk_mwxAKbpB
Data Contamination: From Memorization to Exploitation,https://openreview.net/forum?id=IQv9ssIpU7K
Multi-Stage Framework with Refinement based Point Set Registration for Unsupervised Bi-Lingual Word Alignment,https://openreview.net/forum?id=z7KsNClgofB
Retrieval Data Augmentation Informed by Downstream Question Answering Performance,https://openreview.net/forum?id=e3ujixkK9yS
Breaking Down Questions for Outside-Knowledge Visual Question Answering,https://openreview.net/forum?id=eJi5Pvh08VY
LOPS: Learning Order Inspired Pseudo-Label Selection for Weakly Supervised Text Classification,https://openreview.net/forum?id=jHjDCY-fvSk
Ask Me Anything in Your Native Language,https://openreview.net/forum?id=OJYPlFa4rmX
BERT got a Date: Introducing Transformers to Temporal Tagging,https://openreview.net/forum?id=9onUW-cjTl8
XLTime: A Cross-Lingual Knowledge Transfer Framework for Zero-Shot Low-Resource Language Temporal Expression Extraction,https://openreview.net/forum?id=Ij9UXxQGNmD
Improving the Faithfulness of Abstractive Summarization via Entity Coverage Control,https://openreview.net/forum?id=kT2Rnx1erjr
Active Relation Discovery: Towards General and Label-aware OpenRE,https://openreview.net/forum?id=moQDm_ezXNA
Learning Disentangled Representations in Natural Language Definitions with Semantic Role Labeling Supervision,https://openreview.net/forum?id=rm893aOESdu
How does the pre-training objective affect what large language models learn about linguistic properties?,https://openreview.net/forum?id=SGgyIY2Xro
Cross-cultural Emotion Classification: the Effect of Emotional Intensity and Acoustic Features,https://openreview.net/forum?id=eHVLwJiOlYi
DialogVED: A Pre-trained Latent Variable Encoder-Decoder Model for Dialog Response Generation,https://openreview.net/forum?id=WuVA5LBX5zf
Probing the Robustness of Trained Metrics for Conversational Dialogue Systems,https://openreview.net/forum?id=DsJO6wBxsF-
OneAligner: Zero-shot Cross-lingual Transfer with One Rich-Resource Language Pair for Low-Resource Sentence Retrieval,https://openreview.net/forum?id=FAMbf9YpKc3
"Interpreting character embeddings with perceptual representations: the case of shape, sound, and color",https://openreview.net/forum?id=YeFhaC1k5z2
"When Does Translation Require Context? A Data-driven, Multilingual Exploration",https://openreview.net/forum?id=nZU8lffa5h
CausalR: Causal Reasoning over Natural Language Rulebases,https://openreview.net/forum?id=vuAX_4bv8A
Gradient Sparsification For \\\\emph{Masked Fine-Tuning} of Transformers,https://openreview.net/forum?id=nXEiMRv7Zyq
Who Are We Talking About? Handling Person Names in Speech Translation,https://openreview.net/forum?id=3ou3-3tLTLk
Improved grammatical error correction by ranking elementary edits,https://openreview.net/forum?id=bg470UXkLqF
A New Dataset for Summarizing Radiology Reports,https://openreview.net/forum?id=hVhvWq5onI
Improved Multi-label Classification under Temporal Concept Drift: Rethinking Group-Robust Algorithms in a Label-Wise Setting,https://openreview.net/forum?id=-FrhVMO65W
Repo4QA: Answering Complex Coding Questions via Dense Retrieval on GitHub Repositories,https://openreview.net/forum?id=Vc21sdEwCqa
Bottom Up Parsing via Sequence Labeling,https://openreview.net/forum?id=CMXc3nK27q1
On the Multilingual Capabilities of Very Large-Scale English Language Models,https://openreview.net/forum?id=fSc5SCkrI-B
Discrete Wavelet Transform for Efficient Word Embeddings and Sentence Encoding,https://openreview.net/forum?id=r_I1s2hkUHP
Overcoming a Theoretical Limitation of Self-Attention,https://openreview.net/forum?id=qc9O2EtrMI-
Combating Spurious Features by Distribution Difference Regularization,https://openreview.net/forum?id=nDqz4iCHWJq
Learning to Teach with Student Feedback,https://openreview.net/forum?id=lPx3fzsTTrK
HateBR: Large expert annotated corpus of Brazilian Instagram comments for abusive language detection,https://openreview.net/forum?id=Nd1L1GfqOBS
Power Norm Based Lifelong Learning for Paraphrase Generations,https://openreview.net/forum?id=4TMv3kdrhuc
Aligned Weight Regularizers for Pruning Pretrained Neural Networks,https://openreview.net/forum?id=8Gd6ZzHJG5C
NSP-NER: A Prompt-based Learner for Few-shot NER Driven by Next Sentence Prediction,https://openreview.net/forum?id=8CRReJ4AgsG
Improving Generalizability in Implicitly Abusive Language Detection with Concept Activation Vectors,https://openreview.net/forum?id=AfBuiCDtF_0
That Slepen Al the Nyght with Open Ye! Cross-era Sequence Segmentation with Switch-memory,https://openreview.net/forum?id=RE7ONmfTw7i
A Slot Is Not Built in One Utterance: Spoken Language Dialogs with Sub-Slots,https://openreview.net/forum?id=AjLizwlktx
On Isotropy Calibration of Transformer Models ,https://openreview.net/forum?id=2E1CRNtZP6t
Leveraging Uni-Modal Self-Supervised Learning for Multimodal Audio-visual Speech Recognition,https://openreview.net/forum?id=sFZPi0Dy6XV
Lexical Gender Made Simple: A Scalable Methodology for Gender Detection with Online Lexical Databases,https://openreview.net/forum?id=KxHD64st3JL
Mixture-of-Graphs: Zero-shot Relational Learning for Knowledge Graph by Fusing Ontology and Textual Experts,https://openreview.net/forum?id=RdQXgI1pXt1
Hansel: A Chinese Few-Shot and Zero-Shot Entity Linking Benchmark,https://openreview.net/forum?id=uNL0E5IuuG
What Makes The Story Forward? Inferring Commonsense Explanations as Prompts for Future Event Generation,https://openreview.net/forum?id=hTAhTdgt0D4
Diversifying Neural Dialogue Generation via Negative Distillation,https://openreview.net/forum?id=lrPUCUl7jgK
Packed Levitated Marker for Entity and Relation Extraction,https://openreview.net/forum?id=0YD1VAUGZ-X
Predicting Attention Sparsity in Transformers,https://openreview.net/forum?id=Qu4RXfhYRKa
First Bilingual Word Embeddings for te reo M\\u0101ori and English: Towards Code-switching Detection in a Low-resourced setting,https://openreview.net/forum?id=CAd8LOkxAb
Stable Natural Language Understanding via Invariant Causal Constraint,https://openreview.net/forum?id=pqn1s7ARgYb
Sentence Selection Strategies for Distilling Word Embeddings from BERT,https://openreview.net/forum?id=VreTOiippg_
Spot the Difference: A Cooperative Object-Referring Game in Non-Perfectly Co-Observable Scene,https://openreview.net/forum?id=Jj8UMGBF0RS
Generating Summaries for Scientific Paper Review,https://openreview.net/forum?id=0sRxRtkzfd-
An Empirical Survey of the Effectiveness of Debiasing Techniques for Pre-trained Language Models,https://openreview.net/forum?id=5B-j_cnM7Oo
SlotGAN: Detecting Mentions in Text via Adversarial Distant Learning,https://openreview.net/forum?id=t5rZf5Fvz0k
Textomics: A Dataset for Genomics Data Summary Generation,https://openreview.net/forum?id=uPRJdUfb62q
The Case for a Single Model that can Both Generate Continuations and Fill-in-the-Blank,https://openreview.net/forum?id=0qmlnLlafqv
End-to-end Task-oriented Dialog Policy Learning based on Pre-trained Language Model,https://openreview.net/forum?id=FY12Sx39srI
How to Translate Your Samples and Choose Your Shots? Analyzing Translate-train & Few-shot Cross-lingual Transfer,https://openreview.net/forum?id=EsQHxNYt0u
Rethinking Offensive Text Detection as a Multi-Hop Reasoning Problem,https://openreview.net/forum?id=69pbZhLNcH
A Comprehensive and Large-Scale Dataset for Integrated Argument Mining Tasks,https://openreview.net/forum?id=TnX3iwX_6Iu
Towards Computationally Feasible Deep Active Learning,https://openreview.net/forum?id=fv41yKtPzcl
Data-Driven Adaptive Simultaneous Machine Translation,https://openreview.net/forum?id=fXPJ6aC5dQo
BERT Learns to Teach: Knowledge Distillation with Meta Learning,https://openreview.net/forum?id=hROSL4xfNpH
A  Relation-Attentive 3D Matrix Framework for Relational Triple Extraction,https://openreview.net/forum?id=I52u5Z4KDy0
AutoLEX: An Automatic Framework for Linguistic Exploration,https://openreview.net/forum?id=NiUPI5OLS0o
Answering Open-Domain Multi-Answer Questions via a Recall-then-Verify Framework,https://openreview.net/forum?id=MVcv5KxTqu_
Automatic Song Translation for Tonal Languages,https://openreview.net/forum?id=lMDrXdhP2P
Counselling Summarization using Mental Health Knowledge guided Utterance Filtering,https://openreview.net/forum?id=HG_3q4oywyc
DrugEHRQA: A Question Answering Dataset on Structured and Unstructured Electronic Health Records For Medicine Related Queries,https://openreview.net/forum?id=HBYJawngw5
DAML-ST5: Low Resource Style Transfer via Domain Adaptive Meta Learning,https://openreview.net/forum?id=FvVma0bSUMu
Relation Extraction from Tables using Artificially Generated Metadata,https://openreview.net/forum?id=1R5ZctTSwX-
Do Current Natural Language Inference Models Truly Understand Sentences? Insights from Simple Sentences,https://openreview.net/forum?id=FzJk5alRVP
Analyzing Gender Representation in Multilingual Models,https://openreview.net/forum?id=BFPN7IxqXRv
Improving Unsupervised Sentence Simplification Using Fine-Tuned Masked Language Models,https://openreview.net/forum?id=WpQ4b4b_ENy
Towards Asking Clarification Questions in Task-Oriented Dialogue,https://openreview.net/forum?id=Cr23m4deFPF
Interpretability on clinical analysis from Pattern Disentanglement Insight,https://openreview.net/forum?id=1mnGR8UW-7OO
Can Pre-trained Models Really Generate Single-Step Textual Entailment?,https://openreview.net/forum?id=qFV4ATfOE2C
Adversarial multi-task learning to solve holistic semantic polishing problem of Chinese text,https://openreview.net/forum?id=ZKzFyhMUT8-
Zero-shot Cross-lingual Conversational Semantic Role Labeling,https://openreview.net/forum?id=Qb6XuSBODsW
SumHiS: Extractive Summarization Exploiting Hidden Sctructure,https://openreview.net/forum?id=ZaM7EsLb5X
"All in One: A Multi-Task Learning for Emoji, Sentiment and Emotion Analysis in Code-Mixed Text",https://openreview.net/forum?id=_qM-i0O9A2_
Towards Community-Driven NLP: Measuring Geographic Performance Disparities of Offensive Language Classifiers,https://openreview.net/forum?id=d0ECgzUIS3T
"HighIE: High-Order Inference for Entity Recognition, Relation Extraction, and Event Extraction",https://openreview.net/forum?id=Exljjx1lfcH
An Information-theoretic Approach to Prompt Engineering Without Ground Truth Labels,https://openreview.net/forum?id=2pXdLthNwh2
"What Works and Doesn\'t Work, A Deep Decoder for Neural Machine Translation",https://openreview.net/forum?id=uELLijm1osF
More Informative Dialogue Generation via Multiple Knowledge Selection,https://openreview.net/forum?id=vVoxEasyToY
Unsupervised Domain Adaptation for Event Detection via Meta Self-Paced Learning,https://openreview.net/forum?id=BgUXvB7hn1t
ST-SQL: Semi-Supervised Self-Training for Text-to-SQL via Column Specificity Meta-Learning,https://openreview.net/forum?id=CPdvNQGrOr0
Continual Prompt Tuning for Dialog State Tracking,https://openreview.net/forum?id=1FvpjR6pZug
ARCNN: A Semantic Enhanced Relation Detection Model for Knowledge Base Question Answering,https://openreview.net/forum?id=_TLu-3ucBI
One-to-Many and Many-to-One Dialogue Learning via Sentence Semantic Segmentation Guided Conditional Variational Auto-Encoder,https://openreview.net/forum?id=BaXUNv8-g9G
Improving End-to-end Speech Translation by Leveraging Auxiliary Speech and Text Data,https://openreview.net/forum?id=R6wAUSO2fSr
Improving Controllable Text Generation with Position-Aware Weighted Decoding,https://openreview.net/forum?id=QXlUtiZIARH
Learning Functional Distributional Semantics with Visual Data,https://openreview.net/forum?id=83XIAPSB_pj
Roles of Words: What Should (n\\u2019t) Be Augmented in Text Augmentation on Text Classification Tasks?,https://openreview.net/forum?id=_jpxhquKzO9
Comprehensive Multi-Modal Interactions for Referring Image Segmentation,https://openreview.net/forum?id=mZ_MHVvOwry
AdapLeR: Speeding up Inference by Adaptive Length Reduction,https://openreview.net/forum?id=AYXloseLOi
Toward More Meaningful Resources for Lower-resourced Languages,https://openreview.net/forum?id=UqO_3RE6E7x
End-To-End Sign Language Translation via Multitask Learning,https://openreview.net/forum?id=NOTubDYTfjQ
Rethinking and Refining the Distinct Metric,https://openreview.net/forum?id=Fx7vTiX9Wae
Tracking Satisfaction States for Customer Satisfaction Prediction in E-commerce Service Chatbots,https://openreview.net/forum?id=nu1dPURGSOi
A Zero-Resource Approach to Cross-Lingual Query-Focused Abstractive Summarization,https://openreview.net/forum?id=t0YZGag-6fe
Situated Dialogue Learning through Procedural Environment Generation,https://openreview.net/forum?id=z8yUOveEGqa
Get the Point! Graph Enhanced Candidate Retrieval for Zero-shot Entity Linking,https://openreview.net/forum?id=5eHlYiVukG
Stock Movement Prediction Based on Bi-typed and Hybrid-relational Market Knowledge Graph via Dual Attention Networks,https://openreview.net/forum?id=nXyXgrVOk8k
Understanding Multimodal Procedural Knowledge by Sequencing Multimodal Instructional Manuals,https://openreview.net/forum?id=8njdjhMeRJY
Learning Tokenization in Private Federated Learning with Sub-Word Model Sampling,https://openreview.net/forum?id=3VsqNuliPR
Sentence-aware Contrastive Learning for Open-Domain Passage Retrieval,https://openreview.net/forum?id=t4RMD0mI_k
The Past Mistake is the Future Wisdom: Error-driven Contrastive Probability Optimization for Chinese Spell Checking,https://openreview.net/forum?id=DW8WNS97jP5
Fine-Grained Controllable Text Generation Using Non-Residual Prompting,https://openreview.net/forum?id=poQNS7GAgBJ
From Context to Text: Utilizing Discourse Semantics  In Chinese Zero Pronoun Resolution,https://openreview.net/forum?id=csNgXsD1tx
Building Chinese Biomedical Language Models via Multi-Level Text Discrimination,https://openreview.net/forum?id=avbPntXOwCW
SiSP: Japanese Situation-dependent Sentiment Polarity Dictionary,https://openreview.net/forum?id=IvllkwwgKc4
Automatic Mining of Salient Events from Multiple Documents,https://openreview.net/forum?id=NtU4muk0bvd
Do We Need to Differentiate Negative Candidates Before Training a Neural Ranker?,https://openreview.net/forum?id=oyCPRgwkf5w
A Self-Adaptive Learning Rate and Curriculum Learning Based Framework for Few-Shot Text Classification,https://openreview.net/forum?id=i-lLDEfPRnG
An asynchronous distributed training algorithm based on Gossip,https://openreview.net/forum?id=9AWwcpDj9fV
Improving Compositional Generalization with Self-Training for Data-to-Text Generation,https://openreview.net/forum?id=QTSlG9lWk8
Computational historical linguistics and language diversity in South Asia,https://openreview.net/forum?id=OKvn1-qwsWA
Models can use keywords to answer questions that human cannot,https://openreview.net/forum?id=RmFZIQVG4XN
LINDA: Unsupervised Learning to Interpolate in Natural Language Processing,https://openreview.net/forum?id=dTE4YtueHaD
BigFive: A Dataset of Coarse- and Fine-Grained Personality Characteristics,https://openreview.net/forum?id=6q-mLPJICaa
Detection of Adversarial Examples in NLP: Benchmark and Baseline via Robust Density Estimation,https://openreview.net/forum?id=GO9vQ8BrJtk
Measuring HLT Research Equality of European Languages,https://openreview.net/forum?id=LgRe_HPmQyv
SummaReranker: A Multi-Task Mixture-of-Experts Re-ranking Framework for Abstractive Summarization,https://openreview.net/forum?id=HT9x1moobfz
FLAP: Table-to-Text Generation with Feature Indication and Numerical Reasoning Pretraining,https://openreview.net/forum?id=j6PUcXtiy75
TextMosaic: A New Data Augmentation Method for Named Entity Recognition Using Document-Level Contexts,https://openreview.net/forum?id=EmJCjwPiH_i
Language Level Classification on German Texts using a Neural Approach,https://openreview.net/forum?id=PQl2HPBGRvW
A New Search Paradigm for Natural Language Code Search,https://openreview.net/forum?id=YeaNQgfFwlQ
Domain-aware Self-supervised Pre-training for Weakly-supervised Meme Analysis,https://openreview.net/forum?id=MS79LypM_jA
E-MMAD: Multimodal Advertising Caption Generation Based on Structured Information,https://openreview.net/forum?id=Xp_pRGHM6F0
Fantastic Questions and Where to Find Them: FairytaleQA--An Authentic Dataset for Narrative Comprehension,https://openreview.net/forum?id=o-LWIbKagke
Question-Led Semantic Structure Enhanced Attentions for VQA,https://openreview.net/forum?id=4X-nUzszhp
Towards a Fine-Grained Multi-Domain Neural Machine Translation Using Inter-Domain Relationships,https://openreview.net/forum?id=GnDf8RijEfl
The Sensitivity of Annotator Bias to Task Definitions,https://openreview.net/forum?id=tSgisvw--5B
A Novel Framework Based on Medical Concept Driven Attention for Explainable Medical Code Prediction via External Knowledge,https://openreview.net/forum?id=syvKAodJ-Gj
Identifying Moments of Change from Longitudinal User Text,https://openreview.net/forum?id=Dwqav13klH3
CONJR: Conjunctive Sentence Splitter without Parsing,https://openreview.net/forum?id=nUcR4c0hg5q
Teaching Models new APIs: Domain-Agnostic Simulators for Task Oriented Dialogue,https://openreview.net/forum?id=3u6rOiXR9RA
Modeling Intensification for Signed Language Generation: A Computational Approach,https://openreview.net/forum?id=whBQ1c5Chd5
A Good Prompt Is Worth Millions of Parameters: Low-resource Prompt-based Learning for Vision-Language Models,https://openreview.net/forum?id=P008p9qTbyO
Revisiting the Compositional Generalization Abilities of Neural Sequence Models,https://openreview.net/forum?id=7lJpG58T5qy
Retrieval-guided Counterfactual Generation for QA,https://openreview.net/forum?id=_9QcfD3L0z
Data Augmentation with Sentence Recombination Method for Semi-supervised Text Classification,https://openreview.net/forum?id=WSxxdJdByLS
More Than Words: Collocation Retokenization for Latent Dirichlet Allocation Models,https://openreview.net/forum?id=Bqm_vhc-d6Y
Blackbird\'s language matrices (BLMs): a new benchmark to investigate disentangled generalisation in neural networks,https://openreview.net/forum?id=KsvzWG8G2kv
Learn to Adapt for Generalized Zero-Shot Text Classification,https://openreview.net/forum?id=2NOSFKxicWQ
Language Model-Guided Knowledge Subgraphs for Question Answering,https://openreview.net/forum?id=ZvJdOe_VUXB
Extreme Multi-label Text Classification with Pseudo Label Descriptions,https://openreview.net/forum?id=IbqvTfZZR7X
