,Links
Hierarchical Attention Decoder for Solving Math Word Problems,https://openreview.net/forum?id=tZ6cm6PY1hQ
Repetition Facilitates Processing: The Processing Advantage of Construction Repetition in Dialogue,https://openreview.net/forum?id=Nu1o7f13hBo
Building a Role Specified Open-Domain Dialogue System Leveraging Large-Scale Language Models,https://openreview.net/forum?id=fVaB0w-H1hJ
GlobalWoZ: Globalizing MultiWoZ to Develop Multilingual Task-Oriented Dialogue Systems,https://openreview.net/forum?id=3GilrFL7aU7
High Interpretable Transfer Network for Aspect Level Sentiment Classification,https://openreview.net/forum?id=Omw-DFgi6S
NEWSFARM: the Largest Chinese Corpus for Long News Summarization,https://openreview.net/forum?id=VyQrpIsouZ
Life after BERT: What do Other Muppets Understand about Language?,https://openreview.net/forum?id=1-A3ADcohr
Towards a Progression-Aware Autonomous Dialogue Agent,https://openreview.net/forum?id=UDFO2MjWRUR
Some Languages are More Equal than Others: Probing Deeper into the Linguistic Disparity in the NLP World,https://openreview.net/forum?id=BOluefHO9tQ
Detect Low-Resource Rumors in Microblog Posts via Adversarial Contrastive Learning,https://openreview.net/forum?id=eFeYI1YPuwb
Solving Linear Algebra by Program Synthesis,https://openreview.net/forum?id=3EehDxnUXrS
Pre-training and Fine-tuning Neural Topic Model: A Simple yet Effective Approach to Incorporating External Knowledge,https://openreview.net/forum?id=8ds7iPDUrls
CluSent \\u2013 Combining Semantic Expansion and De-Noising for Dataset-Oriented Sentiment Analysis of Short Texts,https://openreview.net/forum?id=whERrjsVCcZ
Remove Noise and Keep Truth: A Noisy Channel Model for Semantic Role Labeling,https://openreview.net/forum?id=B_hhBeNshop
Research on the Evaluation of Token Imbalance Degree of NMT Corpus,https://openreview.net/forum?id=HuGPs9-uHP
Boosting coherence of language models,https://openreview.net/forum?id=CJQqdS-fx3K
Contrastive Conditional Masked Language Model for Non-autoregressive Neural Machine Translation,https://openreview.net/forum?id=9_j8yJ6ISSr
Fix Bugs with Transformer through a Neural-Symbolic Edit Grammar,https://openreview.net/forum?id=5_ANw2eDtyl
Investigating Crowdsourcing Protocols for Evaluating the Factual Consistency of Summaries,https://openreview.net/forum?id=btMPtNTrVU-
Probing and Generalization of Metaphorical Knowledge in Pre-Trained Language Models,https://openreview.net/forum?id=MCl8iyuFpFL
What does it take to bake a cake? The RecipeRef corpus and anaphora resolution in procedural text,https://openreview.net/forum?id=HDun3Bd39ja
Speaker Information Can Guide Models to Better Inductive Biases: A Case Study On Predicting Code-Switching,https://openreview.net/forum?id=s8J1uDLlufg
Ensembling and Knowledge Distilling of Large Sequence Taggers for Grammatical Error Correction,https://openreview.net/forum?id=MxkLIlvZU6E
Rethinking News Text Classification from a Timeliness Perspective under the Pre-training and Fine-tuning Paradigm,https://openreview.net/forum?id=nVTVR4YvX06
Efficient Long Sequence Encoding via Synchronization,https://openreview.net/forum?id=q3jMqEy4bgX
End-to-end Reference-free Single-document Summary Quality Assessment,https://openreview.net/forum?id=9V5V9O9DCSX
Generating a Temporally Coherent Image Sequence for a Story by Multimodal Recurrent Transformers,https://openreview.net/forum?id=hyQFVwTynuA
EventBERT,https://openreview.net/forum?id=hCOfuizvidH
Phrase-aware Unsupervised Constituency Parsing,https://openreview.net/forum?id=c9pFDJXSGa5
Semantic Role Labeling as Dependency Parsing: Exploring Latent Tree Structures Inside Arguments,https://openreview.net/forum?id=bmF2qC-CUG
MSAMSum: Towards Benchmarking Multi-lingual Dialogue Summarization,https://openreview.net/forum?id=h6g0lrtuaYA
DialFact: A Benchmark for Fact-Checking in Dialogue,https://openreview.net/forum?id=AxPhYKiSbp
Personality Prediction of Narrative Characters from Movie Scripts,https://openreview.net/forum?id=C6zRtm5sMzA
"When did you become so smart, oh wise one?! Sarcasm Explanation in Multi-modal Multi-party Dialogues",https://openreview.net/forum?id=eJUGH5CaCJK
Sequence-to-Sequence Multilingual Pre-Trained Models: A Hope for Low-Resource Language Translation?,https://openreview.net/forum?id=L4cbpTxl72U
EmRel: Joint Representation of Entities and Embedded Relations for Multi-triple Extraction,https://openreview.net/forum?id=2csU2MGpRbN
Learning to Ignore Adversarial Attacks,https://openreview.net/forum?id=jlflpf7P7QY
Sparse Progressive Distillation: Resolving  Overfitting under Pretrain-and-Finetune Paradigm,https://openreview.net/forum?id=W31JU1GRB1U
Automode: Choosing the Best Machine Translation Supplier Based on Source Text,https://openreview.net/forum?id=LNj1U_Sm-l_n
Speech-to-SQL Parsing: Error Correction with Multi-modal Representations,https://openreview.net/forum?id=5pq2nzuClHG
Innovative Measures of Patient and Disease Phenotyping: Optimizing Linguistic and Machine Learning Techniques in the Investigation of Electronic Health Record (EHR) Data,https://openreview.net/forum?id=6tTmE3JCzMq
On the Effect of Isotropy on VAE Representations of Text,https://openreview.net/forum?id=wVpU93kEGc
Composing Structure-Aware Batches for Pairwise Sentence Classification,https://openreview.net/forum?id=DKVhbjXs9aG
Exploiting Data Characteristics for Document-level Event Extraction,https://openreview.net/forum?id=tVF2KuTau5g
ReCLIP: A Strong Zero-Shot Baseline for Referring Expression Comprehension,https://openreview.net/forum?id=eT83GooycXa
Synthetic Question Value Estimation for Domain Adaptation of Question Answering,https://openreview.net/forum?id=U-e3OTlgXwW
Unsupervised Keyphrase Extraction via Interpretable Neural Networks,https://openreview.net/forum?id=u2Pt8ULp7Kd
Are We NER Yet? Measuring the Impact of ASR Errors on Named Entity Recognition in Spontaneous Conversation Transcripts,https://openreview.net/forum?id=Zo4-42mBGex
Hierarchical Recurrent Aggregative Generation for Few-Shot NLG,https://openreview.net/forum?id=iqKzson-1Tl
PREME: Preference-based Meeting Exploration through an Interactive Questionnaire,https://openreview.net/forum?id=p91q-66Svih
MIMICause: Representation and automatic extraction of causal relation types from clinical notes,https://openreview.net/forum?id=4KcQD40NlSM
Is Attention Explanation? An Introduction to the Debate,https://openreview.net/forum?id=xdbuU2dUa9O
Offensive Text Detection Across Languages and Datasets Using Rule-based and Hybrid Methods,https://openreview.net/forum?id=3n6KslGuhHD
A Sentence is Worth 128 Pseudo Tokens: A Semantic-Aware Contrastive Learning Framework for Sentence Embeddings,https://openreview.net/forum?id=FXZuJcgDpgF
Top-Down Influence? Predicting CEO Personality and Risk Impact from Speech Transcripts,https://openreview.net/forum?id=5jsRMDNddKZ
An Investigation of the (In)effectiveness of Counterfactually Augmented Data,https://openreview.net/forum?id=5f4gKU3img0
Maximum Proxy-Likelihood Estimation for Non-autoregressive Machine Translation,https://openreview.net/forum?id=ps4ihHcV19
Semantic-Oriented Unlabeled Priming for Large-Scale Language Models,https://openreview.net/forum?id=A3o2LyGc9K_
Prix-LM: Pretraining for Multilingual Knowledge Base Construction,https://openreview.net/forum?id=y1DoH6Y75rK
SANCL: Multimodal Review Helpfulness Prediction with Selective Attention and Natural Contrastive Learning,https://openreview.net/forum?id=syGBvV6axrY
Towards Few-shot Entity Recognition in Document Images: A Label-aware Sequence-to-Sequence Framework,https://openreview.net/forum?id=ePRpn99yhJi
Fusing Heterogeneous Factors with Triaffine Mechanism for Nested Named Entity Recognition,https://openreview.net/forum?id=OXXX_dfeH7v
Continual Few-shot Relation Learning via Embedding Space Regularization and Data Augmentation,https://openreview.net/forum?id=tN-UlSrCBgM
Consecutive Task-oriented Dialog Policy Learning,https://openreview.net/forum?id=Z2EA4hRCjTi
Extreme Multi-label Text Classification with Multi-layer Experts,https://openreview.net/forum?id=IGAZ8wmBozW
Towards Robust Online Dialogue Response Generation,https://openreview.net/forum?id=MgEOyth-DZQ
Rewire-then-Probe: A Contrastive Recipe for Probing Biomedical Knowledge of Pre-trained Language Models,https://openreview.net/forum?id=wJTFHhrpPIU
Topic-Aware Response Generation in Task-Oriented Dialogue with Unstructured Knowledge Access,https://openreview.net/forum?id=FPpE1tWkC5
Cross-Utterance Conditioned VAE for Non-Autoregressive Text-to-Speech,https://openreview.net/forum?id=i6tHdctpIc2
HiStruct+: Improving Extractive Text Summarization with Hierarchical Structure Information,https://openreview.net/forum?id=i2WUdHUTHTQ
NewsEdits: A Dataset of News Article Revision Histories and a Novel Approach to Document-Level Edit Reasoning,https://openreview.net/forum?id=gDJtrYO-9O
Deep Reinforcement Learning for Entity Alignment,https://openreview.net/forum?id=CRBzhRdkycU
TwittIrish: A Universal Dependencies Treebank of Tweets in Modern Irish,https://openreview.net/forum?id=f1PfVBM3v0r
Biaffine Discourse Dependency Parsing,https://openreview.net/forum?id=nIcRCffatsX
Generated Knowledge Prompting for Commonsense Reasoning,https://openreview.net/forum?id=9hzcBemY20
Empathetic Persuasion: Reinforcing Empathy and Persuasiveness in Dialogue Systems,https://openreview.net/forum?id=oDo65FJacdy
PicTalky: Augmentative and Alternative Communication Software for Language Developmental Disabilities,https://openreview.net/forum?id=VnWsasVHGPM
Improving Neural Models for Radiology Report Retrieval with Lexicon-based Automated Annotation,https://openreview.net/forum?id=i0HdiUT1_KI
Making Transformers Solve Compositional Tasks,https://openreview.net/forum?id=Zey1PpxWJRz
Multimodal Sentiment Analysis with Common-sense Modulation,https://openreview.net/forum?id=0r3eQftCZUT
GenRE: A Generative Model for Relation Extraction,https://openreview.net/forum?id=w0fxBD6tJbV
Logic Traps in Evaluating Attribution Scores,https://openreview.net/forum?id=du9X3J0losl
"Relevant CommonSense Subgraphs for \\""What if...\\"" Procedural Reasoning",https://openreview.net/forum?id=-7JHTpEHPn
Explicit Object Relation Alignment for Vision and Language Navigation,https://openreview.net/forum?id=-TgV5Cufu58
M6-T: Exploring Sparse Expert Models and Beyond,https://openreview.net/forum?id=3GQN9Bwdjdv
Data-adaptive Transfer Learning for Low-resource Translation: A Case Study in Haitian,https://openreview.net/forum?id=nhQlnkAoux
WeTS: A Benchmark for Translation Suggestion,https://openreview.net/forum?id=cFFydlVW7G
KETOD: Knowledge-Enriched Task-Oriented Dialogue,https://openreview.net/forum?id=rfKyAHBUhOq
Autoregressive Language Model for Zero-shot Constrained Keyphrase Generation,https://openreview.net/forum?id=5cU6H8EAxpO
Flagging Comprehensibility Issues in Hindi Text with Question Answering,https://openreview.net/forum?id=uD89_eS35Bt
An Isotropy Analysis in the Multilingual BERT Embedding Space,https://openreview.net/forum?id=eBltGwedCi
GradMask: Gradient-Guided Token Masking for Textual Adversarial Example Detection,https://openreview.net/forum?id=abyb5WF417M
Graph Refinement for Coreference Resolution,https://openreview.net/forum?id=4nIFIb-uWo8
Right for the Right Reason: Evidence Extraction for Trustworthy Tabular Reasoning,https://openreview.net/forum?id=AIzlClbp3x
Prompting as Multimodal Fusing,https://openreview.net/forum?id=wWZCNLkK-FK
Debiased Contrastive Learning of Unsupervised Sentence Representations,https://openreview.net/forum?id=nEPS9wayf3T
An Unsupervised Multiple-Task and Multiple-Teacher Model for Cross-lingual Named Entity Recognition,https://openreview.net/forum?id=8htKQ54Radx
Universal Phone Recognition for Language Agnostic Keyword Search,https://openreview.net/forum?id=Q-YYLHfpAa
FRSUM: Towards Faithful Abstractive Summarization via Enhancing Factual Robustness,https://openreview.net/forum?id=m3gyU0zoCD_
Training Data is More Valuable than You Think: A Simple and Effective Method by Retrieving from Training Data,https://openreview.net/forum?id=bHf273tEkY9
AdaPrune: Pruning Transformer with Sparse Regularization,https://openreview.net/forum?id=_CMSV7FTzGI
Self-supervised Semantic-driven Phoneme Discovery for Zero-resource Speech Recognition,https://openreview.net/forum?id=lf1yqoQZTfa
Unsupervised Domain Adaptation with Contrastive Learning for Cross-domain Chinese NER,https://openreview.net/forum?id=f-NmsmAgrDL
Understanding Attention in Machine Reading Comprehension,https://openreview.net/forum?id=vBGI0irna69
Improve Discourse Dependency Parsing with Contextualized Representations,https://openreview.net/forum?id=p6Gx8159ll4
Measuring Fairness of Text Classifiers via Prediction Sensitivity,https://openreview.net/forum?id=nRMGr434PuG
Improving Syntactic Parsing with Consistency Learning,https://openreview.net/forum?id=mEqYnpJF8LX
Identifying Semantically Difficult Samples to Improve Text Classification,https://openreview.net/forum?id=Ohqq3_Q9_3L
EveMRC: A Two-stage Evidence Modeling For Multi-choice Machine Reading Comprehension,https://openreview.net/forum?id=7BdYd9p5rV
CalBERT - Code-mixed Adaptive Language representations using BERT,https://openreview.net/forum?id=ZdKU7FFJ-79
Local Structure Matters Most: Perturbation Study in NLU,https://openreview.net/forum?id=mBWEZDC3KeO
Is Cross-lingual Evaluation Only About Cross-lingual?,https://openreview.net/forum?id=-3D06n-Fl0b
A New Framework for Fast Automated Phonological Reconstruction Using Trimmed Alignments and Sound Correspondence Patterns,https://openreview.net/forum?id=i71yOeQ3gh8
Focus on the Target\\u2019s Vocabulary: Masked Label Smoothing for Machine Translation,https://openreview.net/forum?id=3MhV5D3wBqX
Generative Prompt Tuning for Relation Classification,https://openreview.net/forum?id=lILSg7aInVH
Towards Robustness of Text-to-SQL Models Against Natural and Realistic Adversarial Table Perturbation,https://openreview.net/forum?id=-FO8vu1DamB
Evaluating the Text-to-SQL Capabilities of Large Language Models,https://openreview.net/forum?id=lYli-bAuK54
Challenges in Region-Specific Image Captioning: A Deep Learning Approach,https://openreview.net/forum?id=VH-Tl1iDjnd
Towards Automated Real-time Evaluation in Text-based Counseling,https://openreview.net/forum?id=Mt65vKZERbg
Controllable Natural Language Generation with Contrastive Prefixes,https://openreview.net/forum?id=EYGbUXsmW8D
A Weak Self-supervision with Transition-Based Modeling for Reference Resolution,https://openreview.net/forum?id=zO6zGKsaex
RNG-KBQA: Generation Augmented Iterative Ranking for Knowledge Base Question Answering,https://openreview.net/forum?id=xEWyJkPuZlI
A Novel Efficient and Effective Preprocessing Strategy for Text Classification,https://openreview.net/forum?id=9hgG9q3vb5Y
Local Differential Privacy for Privacy-Preserving NLP Tasks,https://openreview.net/forum?id=KviNpJWXn-U
SagDRE: Sequence-Aware Graph-Based Document-Level Relation Extraction with Adaptive Margin Loss,https://openreview.net/forum?id=Vi9Cj61ZGsR
Categorial Grammar Induction as a Compositionality Measure for Understanding the Structure of Emergent Languages,https://openreview.net/forum?id=7MIy2ZKIJbN
Training a Turn-level User Engagingness Predictor for Dialogues with Weak Supervision,https://openreview.net/forum?id=MJfmRtVReXs
Prototypical Verbalizer for Prompt-based Few-shot Tuning,https://openreview.net/forum?id=tSfqsV1EVem
Enhancing Text Generation with Inductive Event Reasoning,https://openreview.net/forum?id=pMxb99mJYZ4
Differentiable Learning of Rules with Constants in Knowledge Graph,https://openreview.net/forum?id=co1IsPpK5rZ
Crossword: Estimating Unknown Embeddings using Cross Attention and Alignment Strategies,https://openreview.net/forum?id=kCbUq8tjwNc
Last to Learn Bias: Analyzing and Mitigating a Shortcut in Question Matching,https://openreview.net/forum?id=peJrpYeuzEA
Understanding Gender Bias in Knowledge Base Embeddings,https://openreview.net/forum?id=mcTbeq0cqBM
Hyperlink-induced Pre-training for Passage Retrieval of Open-domain Question Answering,https://openreview.net/forum?id=5BtSP5Wi7gn
ELLE: Efficient Lifelong Pre-training for Emerging Data,https://openreview.net/forum?id=UF7a5kIdzk
From the Detection of Toxic Spans in Online Discussions to the Analysis of Toxic-to-Civil Transfer,https://openreview.net/forum?id=oeBzdJ6CHfh
When More Data Hurts: A Troubling Quirk in Developing Broad-Coverage Natural Language Understanding Systems,https://openreview.net/forum?id=53F2mLQQj8J
Increasing Entity Linking upper bound through a more effective Candidate Generation System,https://openreview.net/forum?id=gG0lBcnXCQw
Class Embeddings for Improved Out-of-Scope Detection in Intent Classification,https://openreview.net/forum?id=Br6vHcHuXHM
BARCOR: Towards A Unified Framework for Conversational Recommendation,https://openreview.net/forum?id=LsW-6FzpUiW
Effective Token Graph Modeling using a Novel Labeling Strategy for Structured Sentiment Analysis,https://openreview.net/forum?id=UI0P4BMeqqy
N-grammer: Augmenting Transformers with latent  n-grams,https://openreview.net/forum?id=GxjCYmQAody
Phone-ing it in: Towards Flexible Multi-Modal Language Model Training by Phonetic Representations of Data,https://openreview.net/forum?id=cBDrOuONuhl
CodeRetriever: Unimodal and Bimodal Contrastive Learning for Code Search,https://openreview.net/forum?id=Jqxi0yHcghg
Fine-grained video paragraph captioning via exploring object-centered internal and external knowledge,https://openreview.net/forum?id=CVMLX_miq8a
HSC-Rocket: An interactive dialogue assistant to make agents composing service better through human feedback,https://openreview.net/forum?id=tiuszgEsW9
Generating Data to Mitigate Spurious Correlations in Natural Language Inference Datasets,https://openreview.net/forum?id=2XUhQv_e70d
A Meta-Learning Approach for Few-Shot (Dis)Agreement Identification in Online Discussions,https://openreview.net/forum?id=OETeobnKUXL
Visual-Language Navigation Pretraining via Prompt-based Environmental Self-exploration,https://openreview.net/forum?id=5qBpV_gBeM
e-CARE: a New Dataset for Exploring Explainable Causal Reasoning,https://openreview.net/forum?id=VhXA2h9n860
StableMoE: Stable Routing Strategy for Mixture of Experts,https://openreview.net/forum?id=nYMRUKrQV5
Structured Pruning Learns Compact and Accurate Models,https://openreview.net/forum?id=S7bmlbwUV8
Towards Fully Self-Supervised Learning of Knowledge from Unstructured Text,https://openreview.net/forum?id=j6lUruWB7m0
Open Domain Question Answering over Virtual Documents: A Unified Approach for Data and Text,https://openreview.net/forum?id=tKTRPNNc7A3
Rumor Detection on Twitter Through SMOTE+RU Hybrid Top Features Extraction Model using Ensemble Method,https://openreview.net/forum?id=MNvpOScCfJE
GauSE: Gaussian Enhanced Self-Attention for Event Extraction,https://openreview.net/forum?id=uvLxnBf2zx
SHIELD: Defending Textual Neural Networks against Black-Box Adversarial Attacks with Stochastic Multi-Expert Patcher,https://openreview.net/forum?id=tA9LZJLqyKT
OpenKorPOS: Democratizing Korean Tokenization with Voting-Based Open Corpus Annotation,https://openreview.net/forum?id=uRVJ8qwi7aF
CaM-Gen: Causally-aware Guided Text Generation,https://openreview.net/forum?id=3ahgCzy7ASM
Combining Paraphrase Pre-trained Model and Controllable Rules for Unsupervised Sentence Simplification,https://openreview.net/forum?id=Gd-yVeT8P6w
Unsupervised Dependency Graph Network,https://openreview.net/forum?id=yYJhaF4-dZ9
UNICON: Unsupervised Intent Discovery via Semantic-level Contrastive Learning,https://openreview.net/forum?id=-jZkAHbpHlk
UniSAr: A Unified Structure-Aware Autoregressive Language Model for Text-to-SQL,https://openreview.net/forum?id=QWqNTJUZzss
Learning Emotion-Aware Contextual Representations for Emotion-Cause Pair Extraction,https://openreview.net/forum?id=msFpRstzoXt
Temporal Language Modeling for Short Text Document Classification with Transformers,https://openreview.net/forum?id=Okx_NapRIiN
Evaluating Extreme Hierarchical Multi-label Classification,https://openreview.net/forum?id=ePdyvmDcX2
Pinyin-bert: A new solution to Chinese pinyin to character conversion task,https://openreview.net/forum?id=4_SfdRz54k_
"Same Neurons, Different Languages: Probing Morphosyntax in Multilingual Pre-trained Models",https://openreview.net/forum?id=_9uQwEX4Hpb
DAQE: Exploring the Direct Assessment on Word-Level Quality Estimation in Machine Translation,https://openreview.net/forum?id=bfFF04cLumE
On the Use of Entity Embeddings from Pre-Trained Language Models for Knowledge Graph Completion,https://openreview.net/forum?id=36uj9y9UdXS
On a Benefit of Masked Language Model Pretraining: Robustness to Simplicity Bias,https://openreview.net/forum?id=iq4q5zvzMt9
PromptBERT: Improving BERT Sentence Embeddings with Prompts,https://openreview.net/forum?id=7I3KTEhKaAK
Structure Representation Learning by Jointly Learning to Pool and Represent,https://openreview.net/forum?id=u7APnx5qszb
C$^3$KG: A Chinese Commonsense Conversation Knowledge Graph,https://openreview.net/forum?id=U9KwypIe7yU
Compact Token Representations with Contextual Quantization for Efficient Document Re-ranking,https://openreview.net/forum?id=zMcPwwJkBLv
A System to Filter out Unwanted Social Media Content in Real-time on iPhones,https://openreview.net/forum?id=RVHhqfKskfs
Explicit Modeling the Context for Chinese NER,https://openreview.net/forum?id=3c2BHw6EpCj
A Graph Fusion Approach to Cross-Lingual Machine Reading Comprehension,https://openreview.net/forum?id=nqyFGAatdm
MDG: Metaphorical Sentence Detection and Generation with Masked Metaphor Modeling,https://openreview.net/forum?id=mPLmX6RVDT2
Towards Interpretable Math Word Problem Solving with Grounded Linguistic Logic Reasoning,https://openreview.net/forum?id=euGE2v_UZgT
So Different Yet So Alike! Constrained Unsupervised Text Style Transfer,https://openreview.net/forum?id=4SoRR0ov-bn
Pairwise proximity metrics for topic modelling evaluation based on BERT embeddings.,https://openreview.net/forum?id=OF82vVwrRmz
Towards Transparent Interactive Semantic Parsing via Step-by-Step Correction,https://openreview.net/forum?id=1-FanTO4C1H
A Multi-task Event and Argument Trigger Detection in Hindi using POS Tagging as an Auxiliary Task,https://openreview.net/forum?id=m7x3FvidXhA
CBLUE: A Chinese Biomedical Language Understanding EvaluationBenchmark,https://openreview.net/forum?id=ZHJ0kw4Ry77
HADE: Hierarchical Affective Dialog Encoder for Personality Recognition in Conversation,https://openreview.net/forum?id=cpMUiyD9EA
"Hey AI, Can You Solve Complex Tasks by Talking to Agents?",https://openreview.net/forum?id=8UJrIgq1m0j
Dynamic Entity Memory Network for Dialogue Relational Triplet Extraction,https://openreview.net/forum?id=Qs__2rPyrl
A Comparative Study of Pre-trained Encoders for Low-Resource Named Entity Recognition,https://openreview.net/forum?id=tJPQtbiO6jv
Generating Authentic Adversarial Examples beyond Meaning-preserving with Doubly Round-trip Translation,https://openreview.net/forum?id=bLOUrQ0lPo
"\\""Is Whole Word Masking Always Better for Chinese BERT?\\"": Probing on Chinese Grammatical Error Correction",https://openreview.net/forum?id=rZV05s_kWMN
Searching for fingerspelled content in American Sign Language,https://openreview.net/forum?id=WSv53LzVXuH
Zero-Shot Script Parsing,https://openreview.net/forum?id=XpsjwTLMpu
How Good is a Recommender in Machine-Assisted Cross Document Event Coreference Resolution Annotation?,https://openreview.net/forum?id=7KeiCuQtFoo
Coreference Resolution as Span Boundary Alignment,https://openreview.net/forum?id=PJy4IpnU7fW
Learning to Rank Visual Stories From Human Ranking Data,https://openreview.net/forum?id=b8lMsO5YtpR
Towards Job-Transition-Tag Graph for a Better Job Title Representation Learning,https://openreview.net/forum?id=d8xNE_8SsR-
Re-thinking Supertags in Linear Context-free Rewriting Systems for Constituency Parsing,https://openreview.net/forum?id=udaYBjwpU_M
Exploring Low-dimensional Intrinsic Task Subspace via Prompt Tuning,https://openreview.net/forum?id=THsPGQg0Pe4
Program Transfer for Answering Complex Questions over Knowledge Bases,https://openreview.net/forum?id=rn8YIulHv03
Dynamic Schema Graph Fusion Network for Multi-Domain Dialogue State Tracking,https://openreview.net/forum?id=RMYtON1qyul
UserIdentifier: Implicit User Representations for Simple and Effective Personalized Sentiment Analysis,https://openreview.net/forum?id=iMNie7QL81W
Auto-completion for Te Reo M\\u0101ori,https://openreview.net/forum?id=1RPMTJ4c-kk
Can Pre-trained Language Models Interpret Similes as Smart as Human?,https://openreview.net/forum?id=cI1BZrJSZZ
How Well Do Multi-hop Reading Comprehension Models Understand Date Information?,https://openreview.net/forum?id=Ougcw7mdk8u
MRCLens: an MRC Dataset Bias Detection Toolkit,https://openreview.net/forum?id=TFvd4d9YyeA
CREATE: A Benchmark for Chinese Short Video Retrieval and Title Generation,https://openreview.net/forum?id=fcxm95P_xO_
LayoutGCN: A Light-weight Architecture for Virtually Rich Document Understanding,https://openreview.net/forum?id=A9aGzw9NRq
Making Small Language Models Better Few-Shot Learners,https://openreview.net/forum?id=ryDLEZuACp
Shallow Parsing for Nepal Bhasa Complement Clauses,https://openreview.net/forum?id=iZMEydyi6Sy
Perturbation-based Self-supervised Attention for Text Classification,https://openreview.net/forum?id=_WRoowuSImQ
HybriDialogue: An Information-Seeking Dialogue Dataset Grounded on Tabular and Textual Data,https://openreview.net/forum?id=52j93pP1Bgd
Data Augmentation and Learned Layer Aggregation for Improved Multilingual Language Understanding in Dialogue,https://openreview.net/forum?id=xvOljdhEPhc
SalesBot: Transitioning from Chit-Chat to Task-Oriented Dialogues,https://openreview.net/forum?id=0Wky3xP0347
"On the Safety of Conversational Models: Taxonomy, Dataset, and Benchmark",https://openreview.net/forum?id=4kVErnnL_FZ
