,links
Towards Better Characterization of Paraphrases,https://openreview.net/forum?id=t2UJIFZVyz4
Multi-Narrative Semantic Intersection Task: Evaluation and Benchmark,https://openreview.net/forum?id=mdSv9jxpdBX
Constructing Multilingual CCG Treebanks from Universal Dependencies,https://openreview.net/forum?id=Ulgk67AQfeW
Multilingual Generative Language Models for Zero-Shot Cross-Lingual Event Argument Extraction,https://openreview.net/forum?id=PK84NwrD_9q
Denoising Large-Scale Image Captioning from Alt-text Data using Content Selection Models,https://openreview.net/forum?id=BkNdZ6HoX6s
"Relevance in Dialogue: An empirical comparison of existing metrics, and a novel simple metric",https://openreview.net/forum?id=aOl-UPZeSwt
Attention Mechanism with Energy-Friendly Operations,https://openreview.net/forum?id=vsUr1EnqSGT
Tag and Not Rewrite: A Probabilistic Model to Unpaired Sentiment and Style Transfer,https://openreview.net/forum?id=Dk8w2SYFoaS
Widely Interpretable Semantic Representation: Frameless Meaning Representation for Broader Applicability,https://openreview.net/forum?id=lZTBTihUdlc
Top-Down Influence? Predicting CEO Personality and Risk Impact from Speech Transcripts,https://openreview.net/forum?id=h45YPjctju9
Hierarchical Recurrent Aggregative Generation for Few-Shot NLG,https://openreview.net/forum?id=eqRNs_CGR50
SeaD: End-to-end Text-to-SQL Generation with Schema-aware Denoising,https://openreview.net/forum?id=Dgx157I8729
Knowledgeable Prompt-tuning: Incorporating Knowledge into Prompt Verbalizer for Text Classification,https://openreview.net/forum?id=qmpCC1qsJF_
Headed-Span-Based Projective Dependency Parsing,https://openreview.net/forum?id=6HUkK1levbi
The Past Mistake is the Future Wisdom: Error-driven Contrastive Probability Optimization for Chinese Spell Checking,https://openreview.net/forum?id=cEA-p49sP8x
Synthetic Data Generation and Joint Learning for Robust Code-Mixed Translation,https://openreview.net/forum?id=cqlqdyDfypP
Combining (Second-Order) Graph-Based and Headed-Span-Based Projective Dependency Parsing,https://openreview.net/forum?id=4mMBs-hCrKx
Hansel: A Chinese Few-Shot and Zero-Shot Entity Linking Benchmark,https://openreview.net/forum?id=kLXFm320Xit
"\\""Is Whole Word Masking Always Better for Chinese BERT?\\"": Probing on Chinese Grammatical Error Correction",https://openreview.net/forum?id=owR_gqXt47k
Improving Generalizability in Implicitly Abusive Language Detection with Concept Activation Vectors,https://openreview.net/forum?id=eRRLIv7DrOX
Digging Errors in NMT: Evaluating and Understanding Model Errors from Hypothesis Distribution,https://openreview.net/forum?id=Yw1AfyQrmUp
Sparse Fuzzy Attention for Structured Sentiment Analysis,https://openreview.net/forum?id=lJrJAPEZ4M0
GradMask: Gradient-Guided Token Masking for Textual Adversarial Example Detection,https://openreview.net/forum?id=fImoryxnH0Z
DiS-ReX: A Multilingual Dataset for Distantly Supervised Relation Extraction,https://openreview.net/forum?id=oIfSEEw8Xfu
Measuring Fairness of Text Classifiers via Prediction Sensitivity,https://openreview.net/forum?id=uOklQslIXe8
Defending Textual Neural Networks against Black-Box Adversarial Attacks with Stochastic Multi-Expert Patcher,https://openreview.net/forum?id=F3lYBj1dpXX
Does BERT really agree ? Fine-grained Analysis of Lexical Dependence on a Syntactic Task,https://openreview.net/forum?id=0I_MQWeF5pE
Commonsense Knowledge-Augmented Pretrained Language Models for Causal Reasoning Classification,https://openreview.net/forum?id=51c-7iGxPri
Gender Roles from Word Embeddings in a Century of Children\\u2019s Books,https://openreview.net/forum?id=1y_41pnSIxC
A Meta-framework for Spatiotemporal Quantity Extraction from Text,https://openreview.net/forum?id=32tW2OOxJ5D
Supervised Relation Classification as Two-way Span-Prediction,https://openreview.net/forum?id=Drjb0jGXtGe
Modeling Future for Neural Machine Translation by Fusing Target Information,https://openreview.net/forum?id=OmJpjgRuSeI
Investigating Logic Tensor Networks for Neural-Symbolic Argument Mining,https://openreview.net/forum?id=41SZu4IPi6N
Making Transformers Solve Compositional Tasks,https://openreview.net/forum?id=5S-L8drL0h7
What Makes Reading Comprehension Questions Difficult? Investigating Variation in Passage Sources and Question Types,https://openreview.net/forum?id=kJob69ydIj-
Improving Abstractive Dialogue Summarization with Speaker-Aware Supervised Contrastive Learning,https://openreview.net/forum?id=DQkcgrmTmbo
Measuring Factual Consistency of Abstractive Summaries,https://openreview.net/forum?id=dTnMpK6jHiv
We need to talk about random seeds,https://openreview.net/forum?id=Z0lw-ozMSEe
AOG-LSTM: A Novel RNN Structure for Visual Storytelling,https://openreview.net/forum?id=aN3joeJh1LD
Exploring the Effectiveness of Student Behavior in Prerequisite Relation Discovery for Concepts,https://openreview.net/forum?id=1eix5Aen_54
Comprehension of Subtitles from Re-Translating Simultaneous Speech Translation,https://openreview.net/forum?id=wWAtD2N68cW
Remixers: A Mixer-Transformer Architecture with Compositional Operators for Natural Language Understanding,https://openreview.net/forum?id=9FHQHJnRtfL
CoDA21: Evaluating Language Understanding Capabilities of NLP Models With Context-Definition Alignment,https://openreview.net/forum?id=OQBNP-eWeIO
Multimodal Audio-textual Architecture for Robust Spoken Language Understanding,https://openreview.net/forum?id=baHiTdWOUgo
RelO: An Overlapping Relation Extraction Dataset and Model,https://openreview.net/forum?id=3rxgHBM48gw
BART-light: One Decoder Layer Is Enough,https://openreview.net/forum?id=9kEcqAD-V5u
FlipDA: Effective and Robust Data Augmentation for Few-Shot Learning,https://openreview.net/forum?id=NFladHWUfRc
Modeling Temporal Entity Representation for Procedural Multimodal Comprehension,https://openreview.net/forum?id=dO3Kzeu8KHX
Film Trailer Generation via Task Decomposition,https://openreview.net/forum?id=GENmh6JWM7j
Placing (Historical) Events on a Timeline: A Classification cum Co-ref Resolution Approach,https://openreview.net/forum?id=Y5tTolyfhoP
Divide and Rule: Effective Pre-Training for Context-Aware Multi-Encoder Translation Models,https://openreview.net/forum?id=dYg10Kalyc3
A Few-Shot Semantic Parser for Wizard-of-Oz Dialogues with the Precise ThingTalk+ Representation,https://openreview.net/forum?id=idyspdwviWr
Unsupervised Personality-Aware Language Identification,https://openreview.net/forum?id=IpiYmpJfmcg
Contrastive Word Embedding Learning for Neural Machine Translation,https://openreview.net/forum?id=yf7b7w78xP8
Context vs Target Word: Quantifying Biases When Applying Models to Lexical Semantic Datasets,https://openreview.net/forum?id=_LrZ6g3zdZy
Extractive Topical Summarization With Aspects,https://openreview.net/forum?id=dTwZya8uNnS
Scaling Laws vs Model Architectures: How does Inductive Bias Influence Scaling? An Extensive Empirical Study on Language Tasks,https://openreview.net/forum?id=Wrtp36cbl61
Cross-Lingual Event Detection via Optimized Adversarial Training,https://openreview.net/forum?id=Lc66vCjVidE
"Probing, Generalization and Application of Metaphorical Knowledge in Pre-trained Language Models",https://openreview.net/forum?id=dhHpdiUiwrP
Consistent Crosslingual Data Transfer for Open Information Extraction,https://openreview.net/forum?id=iq_Jkbwe-kV
An Empirical Study of Document-to-document Neural Machine Translation,https://openreview.net/forum?id=lTbIVRBq8Ta
MarkBERT: Marking Word Boundaries Improves Chinese BERT,https://openreview.net/forum?id=dJ0jXhQ9YHd
Human Schema Curation via Causal Association Rule Mining,https://openreview.net/forum?id=nyB0xsto715
A Simple and Effective Model for Multi-Hop Question Generation,https://openreview.net/forum?id=IV5YUaQ4pzG
Modeling Multi-granularity Segmentation for Rare Words in Neural Machine Translation,https://openreview.net/forum?id=WiZ3Z2HChE0
GraphPrompt: Biomedical Entity Normalization Using Graph-based Prompt Templates,https://openreview.net/forum?id=lUegilCk6TY
Can Language Models Make Fun? A Case Study in Chinese Comical Crosstalk,https://openreview.net/forum?id=htpgN820kub
Improving Personalized Dialogue Generation Models with Data-level Distillation and Diversification,https://openreview.net/forum?id=yaU2ZfyVFgF
Towards Comprehensive Patent Approval Predictions:Beyond Traditional Document Classification,https://openreview.net/forum?id=oQ43ZecmCwe
EIDER: Evidence-enhanced Document-level Relation Extraction,https://openreview.net/forum?id=0B-Sz3m7KH5
DocEE: A Large-Scale Dataset for Document-level Event Extraction,https://openreview.net/forum?id=t5zJTjgwngX
Enhancing the Nonlinear Mutual Dependencies in Transformers with Mutual Information,https://openreview.net/forum?id=Dys8zbWqW3C
AMR-to-text Generation with Graph Structure Reconstruction and Coverage,https://openreview.net/forum?id=6zZEZD2LsxW
Rebuild and Ensemble: Exploring Defense Against Text Adversaries,https://openreview.net/forum?id=l3UVZ30slvl
Learning Emotion-Aware Contextual Representations for Emotion Cause Analysis,https://openreview.net/forum?id=8yJ0RpqNppY
CDM: Combining Extraction and Generation for Definition Modeling,https://openreview.net/forum?id=wVdX61hrmpK
SOS: Systematic Offensive Stereotyping Bias in Word Embeddings,https://openreview.net/forum?id=i7DhBQrfi-e
Graph Neural Networks for Multiparallel Word Alignment,https://openreview.net/forum?id=b61q_mqtf31
Achieving Reliable Human Assessment of Open-Domain Dialogue Systems,https://openreview.net/forum?id=7SQh5IvfeLq
Should a Bot be Sarcastic? Understanding User Preferences Towards Sarcasm Generation,https://openreview.net/forum?id=kV-PzsxIUu2
Towards Overcoming Practical Obstacles to Deploying Deep Active Learning,https://openreview.net/forum?id=Ch1K-07jfmy
Fuse and Rephrase: Efficient Low-Resource Data-to-Text Generation,https://openreview.net/forum?id=9WIYi_ruQhQ
A Survey on Geocoding: Algorithms and Datasets for Toponym Resolution,https://openreview.net/forum?id=NVhMSb0UM0x
Knowledge Neurons in Pretrained Transformers,https://openreview.net/forum?id=XZDvxFlNi6G
Personalized News Recommendation with Candidate-aware User Modeling,https://openreview.net/forum?id=8jL2PN3iY3M
Learning Functional Distributional Semantics with Visual Data,https://openreview.net/forum?id=HJSSYU3swSj
Pseudo-Error Generation for Grammatical Error Correction Based on Learner\\u2019s First Language,https://openreview.net/forum?id=2CkBtUsrKbs
Benchmarking Answer Verification Methods for Question Answering-Based Summarization Evaluation Metrics,https://openreview.net/forum?id=AnaQAjSkPXg
A Variational Hierarchical Model for Neural Cross-Lingual Summarization,https://openreview.net/forum?id=mB_pLPuO7S_
ASSIST: Towards Label Noise-Robust Dialogue State Tracking,https://openreview.net/forum?id=sgmCcvG-3xH
Utterance Rewriting with Contrastive Learning in Multi-turn Dialogue,https://openreview.net/forum?id=4VzVcbbF9Hs
ElitePLM: An Empirical Study on General Language Ability Evaluation of Pretrained Language Models,https://openreview.net/forum?id=vjwdO75bWI0
Transformers Can Compose Skills To Solve Novel Problems Without Finetuning,https://openreview.net/forum?id=ZA6k7c-V1wT
Continual Few-shot Relation Learning via Embedding Space Regularization and Data Augmentation,https://openreview.net/forum?id=QbNdfN86b62
Machine Reading Comprehension: Generative or Extractive Reader?,https://openreview.net/forum?id=1I_wHy6mZAj
Towards Full Utilization on Mask Task for Distilling PLMs into NMT,https://openreview.net/forum?id=TUL_oPO0H2u
Multi-Label Text Classification by Graph Neural Network with Mixing Operations,https://openreview.net/forum?id=SvyTrJoK5uw
e-CARE: a New Dataset for Exploring Explainable Causal Reasoning,https://openreview.net/forum?id=48T0DriwGcv
Meta-Learning with Sparse Experience Replay for Lifelong Language Learning,https://openreview.net/forum?id=MjA-CuGIx95
Focus on the Target\'s Vocabulary: Masked Label Smoothing for Machine Translation,https://openreview.net/forum?id=Moh8zXa3fSC
Learning Low-frequency Patterns with A Pre-trained Document-Grounded Conversation Model,https://openreview.net/forum?id=231kNimht0Q
Accurate Online Posterior Alignments for Principled Lexically-Constrained Decoding,https://openreview.net/forum?id=DutjyHb33yO
"Draft, Command, and Edit: Controllable Text Editing in E-Commerce",https://openreview.net/forum?id=Z38ExoQkXoc
